[
  {
    "id": "jft-ssw-0001",
    "deck": "jft_ssw_starter",
    "stage": 1,
    "target": "在留カードを見せてください。",
    "reading": "ざいりゅうカードをみせてください。",
    "romaji": "Zairyuu kaado o misete kudasai.",
    "meaning": {
      "en": "Please show your residence card."
    },
    "example": {
      "ja": "市役所で在留カードを見せてください。",
      "reading": "しやくしょでざいりゅうカードをみせてください。",
      "en": "Please show your residence card at the city office."
    },
    "question_type": "phrase",
    "tags": [
      "daily_life",
      "city_office",
      "documents"
    ]
  },
  {
    "id": "jft-ssw-0002",
    "deck": "jft_ssw_starter",
    "stage": 1,
    "target": "住所を登録したいです。",
    "reading": "じゅうしょをとうろくしたいです。",
    "romaji": "Juusho o touroku shitai desu.",
    "meaning": {
      "en": "I want to register my address."
    },
    "example": {
      "ja": "新しい住所を登録したいです。",
      "reading": "あたらしいじゅうしょをとうろくしたいです。",
      "en": "I want to register my new address."
    },
    "question_type": "phrase",
    "tags": [
      "daily_life",
      "city_office",
      "housing"
    ]
  },
  {
    "id": "jft-ssw-0003",
    "deck": "jft_ssw_starter",
    "stage": 2,
    "target": "国民健康保険に入りたいです。",
    "reading": "こくみんけんこうほけんにはいりたいです。",
    "romaji": "Kokumin kenkou hoken ni hairitai desu.",
    "meaning": {
      "en": "I want to join national health insurance."
    },
    "example": {
      "ja": "日本に来たので、国民健康保険に入りたいです。",
      "reading": "にほんにきたので、こくみんけんこうほけんにはいりたいです。",
      "en": "I came to Japan, so I want to join national health insurance."
    },
    "question_type": "phrase",
    "tags": [
      "daily_life",
      "health",
      "city_office"
    ]
  },
  {
    "id": "jft-ssw-0004",
    "deck": "jft_ssw_starter",
    "stage": 1,
    "target": "ごみは何曜日に出しますか。",
    "reading": "ごみはなんようびにだしますか。",
    "romaji": "Gomi wa nan-youbi ni dashimasu ka.",
    "meaning": {
      "en": "What day should I put out the trash?"
    },
    "example": {
      "ja": "この町では、ごみは何曜日に出しますか。",
      "reading": "このまちでは、ごみはなんようびにだしますか。",
      "en": "In this town, what day should I put out the trash?"
    },
    "question_type": "situation",
    "tags": [
      "daily_life",
      "housing",
      "schedule"
    ]
  },
  {
    "id": "jft-ssw-0005",
    "deck": "jft_ssw_starter",
    "stage": 1,
    "target": "この電車は新宿に行きますか。",
    "reading": "このでんしゃはしんじゅくにいきますか。",
    "romaji": "Kono densha wa Shinjuku ni ikimasu ka.",
    "meaning": {
      "en": "Does this train go to Shinjuku?"
    },
    "example": {
      "ja": "すみません、この電車は新宿に行きますか。",
      "reading": "すみません、このでんしゃはしんじゅくにいきますか。",
      "en": "Excuse me, does this train go to Shinjuku?"
    },
    "question_type": "situation",
    "tags": [
      "daily_life",
      "transportation",
      "question"
    ]
  },
  {
    "id": "jft-ssw-0006",
    "deck": "jft_ssw_starter",
    "stage": 1,
    "target": "道に迷いました。",
    "reading": "みちにまよいました。",
    "romaji": "Michi ni mayoimashita.",
    "meaning": {
      "en": "I am lost."
    },
    "example": {
      "ja": "すみません、道に迷いました。駅はどこですか。",
      "reading": "すみません、みちにまよいました。えきはどこですか。",
      "en": "Excuse me, I am lost. Where is the station?"
    },
    "question_type": "phrase",
    "tags": [
      "daily_life",
      "transportation",
      "help"
    ]
  },
  {
    "id": "jft-ssw-0007",
    "deck": "jft_ssw_starter",
    "stage": 1,
    "target": "体調が悪いです。",
    "reading": "たいちょうがわるいです。",
    "romaji": "Taichou ga warui desu.",
    "meaning": {
      "en": "I do not feel well."
    },
    "example": {
      "ja": "今日は体調が悪いので、病院に行きます。",
      "reading": "きょうはたいちょうがわるいので、びょういんにいきます。",
      "en": "I do not feel well today, so I will go to the hospital."
    },
    "question_type": "phrase",
    "tags": [
      "daily_life",
      "health",
      "reporting"
    ]
  },
  {
    "id": "jft-ssw-0008",
    "deck": "jft_ssw_starter",
    "stage": 2,
    "target": "薬は一日何回飲みますか。",
    "reading": "くすりはいちにちなんかいのみますか。",
    "romaji": "Kusuri wa ichinichi nankai nomimasu ka.",
    "meaning": {
      "en": "How many times a day should I take the medicine?"
    },
    "example": {
      "ja": "この薬は一日何回飲みますか。",
      "reading": "このくすりはいちにちなんかいのみますか。",
      "en": "How many times a day should I take this medicine?"
    },
    "question_type": "situation",
    "tags": [
      "daily_life",
      "health",
      "question"
    ]
  },
  {
    "id": "jft-ssw-0009",
    "deck": "jft_ssw_starter",
    "stage": 1,
    "target": "ATMはどこですか。",
    "reading": "エーティーエムはどこですか。",
    "romaji": "Ee-tii-emu wa doko desu ka.",
    "meaning": {
      "en": "Where is the ATM?"
    },
    "example": {
      "ja": "近くのATMはどこですか。",
      "reading": "ちかくのエーティーエムはどこですか。",
      "en": "Where is a nearby ATM?"
    },
    "question_type": "phrase",
    "tags": [
      "daily_life",
      "money",
      "question"
    ]
  },
  {
    "id": "jft-ssw-0010",
    "deck": "jft_ssw_starter",
    "stage": 1,
    "target": "領収書をください。",
    "reading": "りょうしゅうしょをください。",
    "romaji": "Ryoushuusho o kudasai.",
    "meaning": {
      "en": "Please give me a receipt."
    },
    "example": {
      "ja": "会社に出すので、領収書をください。",
      "reading": "かいしゃにだすので、りょうしゅうしょをください。",
      "en": "I need to give it to my company, so please give me a receipt."
    },
    "question_type": "phrase",
    "tags": [
      "daily_life",
      "money",
      "polite_request"
    ]
  },
  {
    "id": "jft-ssw-0011",
    "deck": "jft_ssw_starter",
    "stage": 1,
    "target": "作業を始めてください。",
    "reading": "さぎょうをはじめてください。",
    "romaji": "Sagyou o hajimete kudasai.",
    "meaning": {
      "en": "Please start the task."
    },
    "example": {
      "ja": "準備ができたら、作業を始めてください。",
      "reading": "じゅんびができたら、さぎょうをはじめてください。",
      "en": "When you are ready, please start the task."
    },
    "question_type": "workplace",
    "tags": [
      "workplace",
      "instruction",
      "task"
    ]
  },
  {
    "id": "jft-ssw-0012",
    "deck": "jft_ssw_starter",
    "stage": 1,
    "target": "ここにサインしてください。",
    "reading": "ここにサインしてください。",
    "romaji": "Koko ni sain shite kudasai.",
    "meaning": {
      "en": "Please sign here."
    },
    "example": {
      "ja": "確認したら、ここにサインしてください。",
      "reading": "かくにんしたら、ここにサインしてください。",
      "en": "After you check it, please sign here."
    },
    "question_type": "workplace",
    "tags": [
      "workplace",
      "documents",
      "instruction"
    ]
  },
  {
    "id": "jft-ssw-0013",
    "deck": "jft_ssw_starter",
    "stage": 1,
    "target": "この箱を運んでください。",
    "reading": "このはこをはこんでください。",
    "romaji": "Kono hako o hakonde kudasai.",
    "meaning": {
      "en": "Please carry this box."
    },
    "example": {
      "ja": "この箱を入口まで運んでください。",
      "reading": "このはこをいりぐちまではこんでください。",
      "en": "Please carry this box to the entrance."
    },
    "question_type": "workplace",
    "tags": [
      "workplace",
      "instruction",
      "factory"
    ]
  },
  {
    "id": "jft-ssw-0014",
    "deck": "jft_ssw_starter",
    "stage": 1,
    "target": "先に手を洗ってください。",
    "reading": "さきにてをあらってください。",
    "romaji": "Saki ni te o aratte kudasai.",
    "meaning": {
      "en": "Please wash your hands first."
    },
    "example": {
      "ja": "作業の前に、先に手を洗ってください。",
      "reading": "さぎょうのまえに、さきにてをあらってください。",
      "en": "Before the task, please wash your hands first."
    },
    "question_type": "workplace",
    "tags": [
      "workplace",
      "hygiene",
      "instruction"
    ]
  },
  {
    "id": "jft-ssw-0015",
    "deck": "jft_ssw_starter",
    "stage": 2,
    "target": "休憩の前に報告してください。",
    "reading": "きゅうけいのまえにほうこくしてください。",
    "romaji": "Kyuukei no mae ni houkoku shite kudasai.",
    "meaning": {
      "en": "Please report before your break."
    },
    "example": {
      "ja": "終わっていなくても、休憩の前に報告してください。",
      "reading": "おわっていなくても、きゅうけいのまえにほうこくしてください。",
      "en": "Even if it is not finished, please report before your break."
    },
    "question_type": "workplace",
    "tags": [
      "workplace",
      "reporting",
      "schedule"
    ]
  },
  {
    "id": "jft-ssw-0016",
    "deck": "jft_ssw_starter",
    "stage": 2,
    "target": "マニュアルを確認してください。",
    "reading": "マニュアルをかくにんしてください。",
    "romaji": "Manyuaru o kakunin shite kudasai.",
    "meaning": {
      "en": "Please check the manual."
    },
    "example": {
      "ja": "新しい作業なので、マニュアルを確認してください。",
      "reading": "あたらしいさぎょうなので、マニュアルをかくにんしてください。",
      "en": "This is a new task, so please check the manual."
    },
    "question_type": "workplace",
    "tags": [
      "workplace",
      "instruction",
      "manual"
    ]
  },
  {
    "id": "jft-ssw-0017",
    "deck": "jft_ssw_starter",
    "stage": 1,
    "target": "わからない時は聞いてください。",
    "reading": "わからないときはきいてください。",
    "romaji": "Wakaranai toki wa kiite kudasai.",
    "meaning": {
      "en": "Please ask when you do not understand."
    },
    "example": {
      "ja": "一人で決めないで、わからない時は聞いてください。",
      "reading": "ひとりできめないで、わからないときはきいてください。",
      "en": "Do not decide alone; please ask when you do not understand."
    },
    "question_type": "workplace",
    "tags": [
      "workplace",
      "instruction",
      "communication"
    ]
  },
  {
    "id": "jft-ssw-0018",
    "deck": "jft_ssw_starter",
    "stage": 1,
    "target": "この道具を使ってください。",
    "reading": "このどうぐをつかってください。",
    "romaji": "Kono dougu o tsukatte kudasai.",
    "meaning": {
      "en": "Please use this tool."
    },
    "example": {
      "ja": "細かい作業には、この道具を使ってください。",
      "reading": "こまかいさぎょうには、このどうぐをつかってください。",
      "en": "For detailed work, please use this tool."
    },
    "question_type": "workplace",
    "tags": [
      "workplace",
      "tools",
      "instruction"
    ]
  },
  {
    "id": "jft-ssw-0019",
    "deck": "jft_ssw_starter",
    "stage": 1,
    "target": "終わったら片付けてください。",
    "reading": "おわったらかたづけてください。",
    "romaji": "Owattara katazukete kudasai.",
    "meaning": {
      "en": "Please clean up when you finish."
    },
    "example": {
      "ja": "作業が終わったら、机の上を片付けてください。",